2025-01-06 23:21:43 [INFO] Testing logger setup

2025-01-06 23:21:43 [INFO] 
============================================================
Testing section logging
============================================================

2025-01-06 23:21:43 [INFO] 
------------------------------------------------------------
Testing subsection logging
------------------------------------------------------------

2025-01-06 23:21:43 [INFO] 
============================================================
Starting entity information extraction process
============================================================

2025-01-06 23:21:43 [INFO] Processing URLs: ['https://voxposer.github.io/', 'https://lapisrocks.github.io/LanguageAgentTreeSearch/', 'https://sirui-xu.github.io/InterDreamer/']

2025-01-06 23:21:43 [INFO] 
############################################################
Processing URL [1/3]: https://voxposer.github.io/
############################################################

2025-01-06 23:21:43 [INFO] 
------------------------------------------------------------
Scraping webpage content
------------------------------------------------------------

2025-01-06 23:21:45 [INFO] 
------------------------------------------------------------
Detecting schema for webpage content
------------------------------------------------------------

2025-01-06 23:21:51 [INFO] Detected schema: research

2025-01-06 23:21:51 [INFO] Reason: The webpage content describes a research project called VoxPoser, which focuses on robotic manipulation using language models, and includes elements such as abstract, paper, video, and code, indicating a research publication.

2025-01-06 23:21:51 [INFO] 
------------------------------------------------------------
Extracting initial entity data
------------------------------------------------------------

2025-01-06 23:21:51 [INFO] Getting response from open source with extra body for research

2025-01-06 23:21:51 [INFO] Entity schema: <class 'research.Research'>

2025-01-06 23:23:12 [INFO] 
------------------------------------------------------------
No empty fields found, saving initial data
------------------------------------------------------------

2025-01-06 23:23:12 [INFO] 
📊 Summary for https://voxposer.github.io/
────────────────────────────────────────────────────────────
️  Total Processing Duration: 88.22 seconds

❌ No relevant links found
────────────────────────────────────────────────────────────


2025-01-06 23:23:12 [INFO] ✅ Results saved to ./results/Meta-Llama-3.3-70B-Instruct-AWQ-INT4/research/0/voxposer:_composable_3d_value_maps_for_robotic_manipulation_with_language_models.json

2025-01-06 23:23:12 [INFO] 
############################################################
Processing URL [2/3]: https://lapisrocks.github.io/LanguageAgentTreeSearch/
############################################################

2025-01-06 23:23:12 [INFO] 
------------------------------------------------------------
Scraping webpage content
------------------------------------------------------------

2025-01-06 23:23:13 [INFO] 
------------------------------------------------------------
Detecting schema for webpage content
------------------------------------------------------------

2025-01-06 23:23:17 [INFO] Detected schema: research

2025-01-06 23:23:17 [INFO] Reason: The webpage content includes a paper title, abstract, results, and citations, which are typical components of a research paper, and the content discusses a specific research project called Language Agent Tree Search.

2025-01-06 23:23:17 [INFO] 
------------------------------------------------------------
Extracting initial entity data
------------------------------------------------------------

2025-01-06 23:23:17 [INFO] Getting response from open source with extra body for research

2025-01-06 23:23:17 [INFO] Entity schema: <class 'research.Research'>

2025-01-06 23:23:47 [INFO] 
------------------------------------------------------------
Gathering relevant links recursively
------------------------------------------------------------

2025-01-06 23:23:47 [INFO] Discovered 0 relevant links:

2025-01-06 23:23:47 [INFO] 
------------------------------------------------------------
Extracting information from relevant links
------------------------------------------------------------

2025-01-06 23:23:47 [INFO] Updating information with relevant links...

2025-01-06 23:23:47 [INFO] Saving final results...

2025-01-06 23:23:47 [INFO] Results saved to ./results/Meta-Llama-3.3-70B-Instruct-AWQ-INT4/research/0/language_agent_tree_search.json

2025-01-06 23:23:47 [INFO] 
📊 Summary for https://lapisrocks.github.io/LanguageAgentTreeSearch/
────────────────────────────────────────────────────────────
️  Total Processing Duration: 35.46 seconds

❌ No relevant links found
────────────────────────────────────────────────────────────


2025-01-06 23:23:47 [INFO] ✅ Results saved to ./results/Meta-Llama-3.3-70B-Instruct-AWQ-INT4/research/0/language_agent_tree_search.json

2025-01-06 23:23:47 [INFO] 
############################################################
Processing URL [3/3]: https://sirui-xu.github.io/InterDreamer/
############################################################

2025-01-06 23:23:47 [INFO] 
------------------------------------------------------------
Scraping webpage content
------------------------------------------------------------

2025-01-06 23:23:48 [INFO] 
------------------------------------------------------------
Detecting schema for webpage content
------------------------------------------------------------

2025-01-06 23:23:54 [INFO] Detected schema: research

2025-01-06 23:23:54 [INFO] Reason: The webpage content discusses a research paper titled 'InterDreamer: Zero-Shot Text to 3D Dynamic Human-Object Interaction' presented at NeurIPS 2024, including its methodology, results, and comparison to existing work, which indicates that it matches the research schema.

2025-01-06 23:23:54 [INFO] 
------------------------------------------------------------
Extracting initial entity data
------------------------------------------------------------

2025-01-06 23:23:54 [INFO] Getting response from open source with extra body for research

2025-01-06 23:23:54 [INFO] Entity schema: <class 'research.Research'>

2025-01-06 23:24:26 [INFO] 
------------------------------------------------------------
No empty fields found, saving initial data
------------------------------------------------------------

2025-01-06 23:24:26 [INFO] 
📊 Summary for https://sirui-xu.github.io/InterDreamer/
────────────────────────────────────────────────────────────
️  Total Processing Duration: 38.69 seconds

❌ No relevant links found
────────────────────────────────────────────────────────────


2025-01-06 23:24:26 [INFO] ✅ Results saved to ./results/Meta-Llama-3.3-70B-Instruct-AWQ-INT4/research/0/interdreamer:_zero-shot_text_to_3d_dynamic_human-object_interaction.json

2025-01-06 23:24:26 [INFO] 
============================================================
Final Process Summary
============================================================

2025-01-06 23:24:26 [INFO] Total Processing Time: 162.38 seconds

2025-01-06 23:24:26 [INFO] Number of URLs Processed: 3

2025-01-06 23:24:26 [INFO] 📊 Detailed Analysis by URL:

2025-01-06 23:24:26 [INFO] 
────────────────────────────────────────────────────────────

2025-01-06 23:24:26 [INFO]  https://voxposer.github.io/

2025-01-06 23:24:26 [INFO] ️  Processing Time: 88.22 seconds

2025-01-06 23:24:26 [INFO] 
❌ No relevant links found for this URL

2025-01-06 23:24:26 [INFO] 
────────────────────────────────────────────────────────────

2025-01-06 23:24:26 [INFO] 
────────────────────────────────────────────────────────────

2025-01-06 23:24:26 [INFO]  https://lapisrocks.github.io/LanguageAgentTreeSearch/

2025-01-06 23:24:26 [INFO] ️  Processing Time: 35.46 seconds

2025-01-06 23:24:26 [INFO] 
❌ No relevant links found for this URL

2025-01-06 23:24:26 [INFO] 
────────────────────────────────────────────────────────────

2025-01-06 23:24:26 [INFO] 
────────────────────────────────────────────────────────────

2025-01-06 23:24:26 [INFO]  https://sirui-xu.github.io/InterDreamer/

2025-01-06 23:24:26 [INFO] ️  Processing Time: 38.69 seconds

2025-01-06 23:24:26 [INFO] 
❌ No relevant links found for this URL

2025-01-06 23:24:26 [INFO] 
────────────────────────────────────────────────────────────

2025-01-06 23:24:26 [INFO] 
============================================================
Writing process statistics to CSV
============================================================

2025-01-06 23:24:26 [INFO] 📊 Process statistics written to: ./results/Meta-Llama-3.3-70B-Instruct-AWQ-INT4/0/process_stats_20250106_232426.csv

2025-01-06 23:24:26 [INFO] 
============================================================
✅ Process completed successfully!
============================================================

